title,body,upvotes,comments,created
Supermicro - hold or sell - my strategy,"Disclosure of related position: I bought Supermicro for my growth and momentum trading strategy back in January 2022 for $43.20 (split aligned $4.32) and then doubled down the 6th of September 2022 for $64.22 (split aligned $6.422). Then I partially sold 15th May 2023 at 137.19 (split aligned 13.719), 10th of January 2024 at  $355 (split aligned $35.5) and 12th of September 2024 at $442.13 (split aligned $44.231).

I took out already much more than I did put in, but still own a large position of SMCI. Now I'm in the process of changing the rule for a complete selling in my strategy. As you can see in my disclosure I left a lot of money on the table which already made me change the way I take partial gains.

But let's speak about Supermicro here. What happened:

Hindenburg took a short position and published a report about bookkeeping fraud at Supermicro. Then the auditor, Ernst & Young, resigned. The company is now behind on the mandatory reports to the SEC two quarters. This weekend is the deadline for a de-listing on the NASDAQ. The stock tanked 82% from the high. According to the actual published numbers (which may be corrected) the stock is now almost as cheap as when I bought it first, even if the value more than quadrupled still after the loss of 82%.

Now, Hindenburg at first only cited ex employees as source. But the resignation of Ernst & Young as auditor was probably an ace in Hindenburgs sleeve. I personally know Ernst & Young, they are not exactly my favorites. Since they published the report there was a mass of bad news published, the exact same analysts that hived Supermicro to the SP500 more or less exactly at the high say now it is junk after that loss.

I was thinking about Apple. In the time it would have been most profitable to buy everybody shouted sell. The stock lost more than once 80% of its market value.

Supermicro owns a lot of very unique patents. Their liquid cooled systems take less time to build and are more modular than any of the other competitors systems, Dell being its main competitor. Even if they reported some orders too early as sale they sell a lot lot more than a few years ago thanks to AI. And they will probably sell a lot more.

I think it is very possible that we cannot trade Supermicro on the Nasdaq next week. An that means it will fall out of the SP500 and the NASDAQ 100, putting a lot of sell pressure on the ETF that mirror those indices. Or, Supermicro presents a new auditor and a plan to deliver the reports to the SEC by this weekend.

It is probably a binary bet that will be resolved soon. In my opinion the upside (probability to win multiplied with amount to win) is much higher than the downside (probability to lose multiplied with amount to lose). And even if it is delisted, it is far away from being worthless. Probably it will be a target for Dell.

Here a [chart of Apple](https://www.tradingview.com/x/SDXjHW8c/) when it made most sense to hold them and when they lost a lot.",38,76,1731495213.0
"r/Stocks Daily Discussion Wednesday - Nov 13, 2024","These daily discussions run from Monday to Friday including during our themed posts.

Some helpful links:

* [Finviz](https://finviz.com/quote.ashx?t=spy) for charts, fundamentals, and aggregated news on individual stocks
* [Bloomberg market news](https://www.bloomberg.com/markets)
* StreetInsider news:
  * [Market Check](https://www.streetinsider.com/Market+Check) - Possibly why the market is doing what it's doing including sudden spikes/dips
  * [Reuters aggregated](https://www.streetinsider.com/Reuters) - Global news

If you have a basic question, for example ""what is EPS,"" then google ""investopedia EPS"" and click the investopedia article on it; do this for everything until you have a more in depth question or just want to share what you learned.

Please discuss your portfolios in the [Rate My Portfolio sticky.](https://www.reddit.com/r/stocks/search?q=author%3Aautomoderator+title%3A%22Rate+My+Portfolio%22&restrict_sr=on&sort=new&t=all).

See our past [daily discussions here.](https://www.reddit.com/r/stocks/search?q=author%3Aautomoderator+%22r%2Fstocks+daily+discussion%22&restrict_sr=on&sort=new&t=all)  Also links for:  [Technicals](https://www.reddit.com/r/stocks/search?q=author%3Aautomoderator+title%3Atechnicals&restrict_sr=on&include_over_18=on&sort=new&t=all) Tuesday, [Options Trading](https://www.reddit.com/r/stocks/search?q=author%3Aautomoderator+title%3Aoptions&restrict_sr=on&include_over_18=on&sort=new&t=all) Thursday, and [Fundamentals](https://www.reddit.com/r/stocks/search?q=author%3Aautomoderator+title%3Afundamentals&restrict_sr=on&include_over_18=on&sort=new&t=all) Friday.",17,395,1731493810.0
Why do some chapter 11s wipe out shareholders while some don’t ? ,"I know the majority of chapter 11’s will basically make stock value 0 and leave stock holders with nothing. However, in cases like American Airlines or Hertz they were able to keep equity for shareholders. I know these two examples are a bit different in that Hertz was able to raise money fast and AA was able to do a merger. Does this have to do with restructuring and whether or not they can reduce debt enough? Also what are the benefits of letting shareholders keep equity if they’re already filing for chapter 11? Are there any additional reasons ? ",20,2,1731488975.0
(AHR) I’m back as promised; +44% since first post; senior living healthcare REIT sector outperforming; earnings release once again beat est.,"My first two posts: 

https://www.reddit.com/r/stocks/s/4OEM4c1Bq9

https://www.reddit.com/r/stocks/s/bKcUEjlglR

All in all with the rise and fall of recession fears and the hovering election reactions - to cover the catalysts as of previous:

Federal rate cuts and lessening borrowing fees, growing average senior age, dwindling rates of new construction resulting in higher occupancy rates, and greater focus on specialized senior healthcare. 

For American Healthcare REIT - Currently the peak was +44% from initial post - with earnings from today beating wall street analyst EPS by 12.5% and beating YoY growth in 3/4 asset incomes. With debt, asset evaluations and growth rate as a rough value estimate, I believe it’s nearing the $30 fair value since it’s IPO earlier this year after they have purchased the final 24% minority stake of Trilogy Healthcare which has generated the majority of revenue from the company. They’ve done a stand up job making focuses on specialized care for senior homes and removing the outpatient medical properties, selling them off as they’ve been underperforming as of recent. I expect more reports of increased occupancy rates nearing 90% which would be pre-Covid levels. 

For the healthcare REIT sector - over the past year with recovery from COVID effects - the healthcare REIT stock sector has outperformed the US market by 22.7%, and the real estate sector in general by 65.8%. With the constantly increased forward guidance every quarter for AHR  and associated senior living REITs and the narrowing rate of new constructions that aren’t set to appear in bulk in the industry at least for a year or so - I expect the atmosphere to be relatively competitive.

The sector i believe will stay strong in the long run but especially right now during times of expensive new constructions costs, while dwindling interest rates (for now) will most likely give way to these companies projecting new asset properties to expand their revenue streams, the landscape is tight while the populace of seniors continues to grow by the day. 

NOTE: Earnings release can be found here

https://ir.americanhealthcarereit.com/news/news-details/2024/American-Healthcare-REIT-AHR-Announces-Third-Quarter-2024-Results-Increases-Full-Year-2024-Guidance/default.aspx

The earnings call will take place early in the day 11/13. With the landscape not being quite so clear currently - I hope to expect highlights of the acquisitions made the last quarter as well as any future plans for developments.",2,5,1731472309.0
Tejon Ranch could be the new st Joe or Howard Hughes,"$TRC - Tejon Ranch Co - 450m mkt cap

Tejon is one of the largest land holding companies in the US, owning 270,000 acres (1,093 km2) in California. its owns the tejon commerce center and is planning 3 new master planned comunities.

Stock has been crap over the last 10,20,30 years and board was very poor, horrible capital allocation and disproportionate salaries.

Can’t understate how important last week could be for Tejon as it starts its journey of improving shareholder relationships and path to unlocking value.

@Nitorcap had a great write up in their activist letter:

https://www.globenewswire.com/news-release/2024/04/18/2865308/0/en/Nitor-Capital-Management-Issues-Letter-to-Tejon-Ranch-Stockholders-Announcing-its-Intention-to-Withhold-Support-for-Four-Directors-at-2024-Annual-Meeting.html 

After months of pushing for a new board and CEO the first step was taken last week. 4 new board members including one agreed upon with with Nitor.

In my opinion TRC could be the new St Joe co or a target for Howard Hughes $HHH or bill ackman

Up to now TRC’s board was like a cemetary (no offense) 

average age of the board was above 80 and most people had been with the company for over 20 years..

It feels like the board only cares about their own salary.. instead of minority shareholders

hopefully this changes now



sky is the limit",0,6,1731452935.0
"Will UPS stock get a boost from holiday shipping this year?
","UPS stock has been lackluster in recovering from the drop in the stock since July's poorly received earning's call from CEO Carol Tome, it didn't help that a Barclays analyst on Oct 26 downgraded UPS saying the stock should trade around $100 due to competition from non union LTL trucking companies like FedEx, Old Dominion and Amazon. 

The stock is trading around $132. Concerned that the stock won't get a usual boost from holiday shipping like in past years in November & December. Bought it at $145 and want to at least sell for $150. Will UPS become a lost cause utility like stock or are great things yet to come?",0,10,1731451813.0
Made three “poor” purchases… how do I know when to take my losses.,"I made 3-4 badly timed purchases. All relatively small amounts of money but I’m asking questions because I want to treat this like a I bought:

1 share of MRNA when I thought it’s crash was over. It’s down 34% so I lost 23$. Is

I bought 3 shares of mrk. It’s down 7-8% so I’m down 24$

I bought 5 of F it’s down 11% I lost 7.13.

I bought 2 anet it’s down 3% I’ve lost 22$

My instinct is to hold. These are all high dividend stocks, typically stable. So I am hoping to at least make some loss up. But is this naive? I thought this when mrna was down 10% and it just keeps crashing… which I don’t get. I’m in biotech. They have a phenomenal portfolio and beat earning estimates. ",0,39,1731446413.0
 CPI report vs Stocks," Tomorrow is the CPI report due.
What is the relationship between CPI report and stocks? Anybody with a sound knowledge on this, please explain. All stocks red today.. Or slow movement. I believe it has something to do with CPI index. Can anyone explain it please?",3,8,1731444057.0
Finding good mean reverting stocks,"I came to know that adf test and hurst exponent are useful to find the mean reverting stock. How true this is?
And if these tests are useful, is there any platform which can help me in performing these tests in an easy manner as currently I didn’t find any website to perform these tests and made my own method to perform the adf test which is very hectic.
How I’m performing the adf test:
1.Currently I’m downloading the historical data exporting it in an excel sheet.
2. Reading this file in the python and converting it into and array.
3. Using the adf function on the array and getting the results

This is a really hectic way and takes alot of time and energy. Haven’t made something similar for the hurst exponent yet as I don’t know whether these to tests will give me the mean reverting stocks or not.

I used chat gpt and it told me these to test to find out the stocks.

So I just want to know:
1. Whether these test will help me in finding mean reverting stocks or not.
2. If not, then how can I find them? What ways should I use?
3. If yes, then are these 2 test enough? And is there any platform which can help me perform these tests like just creating an excel sheet and uploading it into a tool and getting the results as this will be really helpful.

Ps. I’m new to trading so please correct me if I’m wrong anywhere and I hadn’t checked stocks using this strategy yet.",6,1,1731440946.0
Chipotle (CMG) vs NVIDIA (NVDA) growth for 2025,"When both companies went through a stock split early this year (CMG was north of $3,000 and NVDA north of $1,200) I jumped on a few shares as both companies had tremendous growth. CMG stock has increased 250% past couple years, and plans to open between 285 and 315 new restaurants next year, and get into some international markets for the first time, it has experienced revenue growth that even big places like Taco Bell and McDonalds haven’t seen with fewer locations. NVDA has been deemed the most valuable company, AI is the wave of the digital future with NVDA leading the charge, and CMG just makes burritos and bowls but great P/E ratio and same-store sales. Both are two totally different markets and all, but am considering selling my CMG share and dumping them in NVDA. Thoughts? ",0,28,1731440494.0
Who profits most from car industry?,"As title suggest,

I'm wondering which segment within the car industry brings in the most profit?

I recently revisited the sector since my GPI holding is already over 200%. My thesis back then was the diversification between new/used/maintenance & international as it was something I felt important to be exposed to. However I am left uneducated on the overall industry.

I see car dealership stocks climbing higher and higher despite headlines of slowing sales or negative growth.

Car manufactures & car maker are always flat.

Car repairs seem healthy

I see multiple car parts stocks being down quite a bit.

It seems strange if the industry is slowing that the dealership don't seem impacted?",38,40,1731439178.0
Hedge Strategy to protect Winners,"I have certain positions that I would like to hold for long term like 10-15years. 

Is there a strategy to protect against downside like buy quarterly puts of the 1% of portfolio? I understand this would cost 4% of gains yearly.

Another strategy is to buy some puts when the stock reaches certain milestone or when it feels over-valued.

Looking for professional advice and strategies on Hedging without selling my winners.",5,21,1731438761.0
Could ACHR be the next big thing?,I've been buying smaller stocks of company's that have a chance of sky rocketing. I own like 20 shares of ACHR for around $2.80 and it has recently started making leaps. They just hired a Saudi director who is the youngest director ever on board of aviation authority and reports directly to the crown prince. They plan to have their UAE air taxis running by end of 2025. They have been blazing through the regulatory side of things and other news articles are saying this could be a once in a decade industry that has a real chance of blowing up huge. I just wanted an outside opinion if I should focus on just this now or bad idea?,82,73,1731436657.0
TTEK $12 Billion contract ?,"Recently made an etrade account for savings/retirement and I've got a slow winter so I put $800 into a brokerage to play with and probably turn into $700 lol.  I'm aware that its just gambling and I've accepted the potential of losing all $800 i just wanna get some trading  experience have a little fun and maybe learn some stuff

First thing I did was buy some MCD during the Ecoli thing and sold it when it went back up (made $10) then I found this company Tetra Tech (TTEK) and bought 8 shares at $46. I did this because I saw they recently won a 12 billion contract with DLA as well as a couple other multi million dollar gov contracts. 

  
Price has gone up a little its only been a week or less but I'm confused am I totally misreading how stocks work. I would assume when a company starts making a ton of money the stock goes up. 

Obviously they havent earned that 12 billion yet but are these contracts not as concrete as they seem? Am I thinking stupidly about this? 

Another red flag is that in the last year it looks like the CEO and CFO have sold millions worth of shares.

Any advice would be much appreciated!",7,5,1731435106.0
Disney - what am I getting for $100?,"Starting a new conversation on DIS, as the last one is almost 3 month old. My tone will be neutral, because I'm just contemplating my decision about DIS stock. Don't know Long or Short?

So, what does $100 buy me:

* Disney+ streaming service with 130M subscribers. That's half of NFLX. You do the math. Punish Disney for ""meh"" content quality in comparison to NFLX, but then, not everyone needs *edge of chair, nail biting* content. Think about boomers who just want to look at a glowing TV screen with drama soaps on.
* Top notch studios like Marvel, Pixar, 20th century, ABC. Sports network of ESPN.
* Theme parks in US, Paris, China, Tokyo. Cruise line (probably a cash burner).
* New CEO in early 2026, meaning.. plenty of time for Iger to look for a new job, leverage, armtwist whatever he has in mind.
* PE of 38 against 12 of Comcast.

All things considered, I'll pass. Stock price movement too is so ""meh"" that it's not even worth shorting 🤣 

Should I rather spend $100 on Disneyland entry ticket? What say?",0,75,1731430112.0
Anyone else getting nervous about an impending recession?,"Prices feel inflated.  Tomorrow's prices are priced in today and as that continues every day at some point that logic ceases to be ""investing"" but rather ""speculation"" and thats the key-word behind every bubble.

If you've listened/read anything from the most successful investors, all the red flags they bring up are being seen now.   When EVERYONE is so optimistic is now whats making me most nervous.  If you read about major crashes and recessions of the past, they are always precipitated with quotes from investors about how if you're not in the market you're losing out and everythings looking great, future is great,

Tariffs will be inflationary.  Tax cuts will disproportionately favor big businesses.  Interest rates are going down because the fed is reactionary. All of these have the recipe for inflation to increase again but this time squeezing americans to the point where buying stops.  It will also induce a panic in the market that might trigger a large correction.   Trump wants to increase local production which will help in the short-run, but his foreign policy is unpredictable so hard to say what oil imports will do.

I think most people have some cautious optimism, but at what point does it become more caution than optimism?

I'm thinking of liquidating and just holding treasuries or safe stocks like berkshire.  In essence, I'm becoming fearful when almost everyone seems greedy.  The timeframe what I'm talking about is maybe 1 to a few years. What are your guys' thoughts?",0,69,1731429157.0
Out of the “Big 7” any you’d recommend buying over others?,"Wanna buy 2-3 of the big 7 stocks, atm thinking of google, Nvidia, and maybe another.
All these stocks are at the highest they’ve ever been basically so maybe not best to buy but who knows if the market will keep climbing so I’ll buy and hold for probably 2 years at least. If I need to hold longer for that I probably can. I’m somewhat new to investing so just wanna see y’all’s thoughts. Should I just wait? That would be timing the market and seems like a bad idea haha. Buying now and averaging my price down if need be sounds smarter.",34,164,1731423941.0
How has Walgreens not cut their dividend yet?,"I have never held a position in WBA but I do follow the stock. After the beating they took throughout the year, the missed earning and the store closures, I figured it was a certainty they would cut their dividend. Amazingly they have not done so and still sit on a 10% yield. On one hand I am tempted to enter a position just because of the ridiculous yield, but I can’t believe it’s sustainable. Nevertheless the 10% yield has held for nearly 6 months and I’m starting to feel like if the business doesn’t actually fold it could actually be a solid way to park some funds and maybe capture a turnaround play. It’s too risky for my blood but wanted to get others thoughts and opinions about this ridiculously high yield dividend on a struggling company ",35,34,1731412232.0
"r/Stocks Daily Discussion & Technicals Tuesday - Nov 12, 2024","This is the daily discussion, so anything stocks related is fine, but the theme for today is on technical analysis (TA), but if TA is not your thing then just ignore the theme.

Some helpful day to day links, including news:

* [Finviz](https://finviz.com/quote.ashx?t=spy) for charts, fundamentals, and aggregated news on individual stocks
* [Bloomberg market news](https://www.bloomberg.com/markets)
* StreetInsider news:
  * [Market Check](https://www.streetinsider.com/Market+Check) - Possibly why the market is doing what it's doing including sudden spikes/dips
  * [Reuters aggregated](https://www.streetinsider.com/Reuters) - Global news

-----

**Technical analysis (TA)** uses historical price movements, real time data, indicators based on math and/or statistics, and charts; all of which help **measure the trajectory of a security.**  TA can also be used to interpret the actions of other market participants and predict their actions.
        
The main benefit to TA is that everything shows up in the price (commonly known as **""priced in""**):  All news, investor sentiment, and changes to fundamentals are reflected in a security's price.

TA can be useful on any timeframe, both short and long term.

Intro to technical analysis by [Stockcharts chartschool](https://stockcharts.com/school/doku.php?id=chart_school:technical_indicators:introduction_to_technical_indicators_and_oscillators#benefits_and_drawbacks_of_leading_indicators) and their [article on candlesticks](https://stockcharts.com/school/doku.php?id=chart_school:chart_analysis:introduction_to_candlesticks)

If you have questions, please see the following word cloud and click through for the wiki:

[Indicator - Trade Signals - Lagging Indicator - Leading Indicator - Oversold - Overbought - Divergence - Whipsaw - Resistance - Support - Breakout/Breakdown - Alerts - Trend line - Market Participants - Moving average - RSI - VWAP - MACD - ATR - Bollinger Bands - Ichimoku clouds - Methods - Trend Following - Fading - Channels - Patterns - Pivots](https://www.reddit.com/r/stocks/wiki/ta-themed-post)

See our past [daily discussions here.](https://www.reddit.com/r/stocks/search?q=author%3Aautomoderator+%22r%2Fstocks+daily+discussion%22&restrict_sr=on&sort=new&t=all)  Also links for:  [Technicals](https://www.reddit.com/r/stocks/search?q=author%3Aautomoderator+title%3Atechnicals&restrict_sr=on&include_over_18=on&sort=new&t=all) Tuesday, [Options Trading](https://www.reddit.com/r/stocks/search?q=author%3Aautomoderator+title%3Aoptions&restrict_sr=on&include_over_18=on&sort=new&t=all) Thursday, and [Fundamentals](https://www.reddit.com/r/stocks/search?q=author%3Aautomoderator+title%3Afundamentals&restrict_sr=on&include_over_18=on&sort=new&t=all) Friday.",12,284,1731407410.0
"MindMed Report: HC Wainwright $55 Valuation, Up Nearly 150% YTD","Mind Medicine (MNMD) [""Buy""](https://www.marketbeat.com/stocks/NASDAQ/MNMD/forecast/) Rating Reiterated at HC Wainwright, with all twelve analysts saying its buy time.

[MindMed ](https://www.businesswire.com/news/home/20241107702200/en/MindMed-Reports-Third-Quarter-2024-Financial-Results-and-Business-Updates)has reported its financial results for Q3 '24 and shared key updates on its clinical development programs.

MindMed is on track to begin the Phase 3 Voyage study for MM120 Orally Disintegrating Tablet (ODT) in Generalized Anxiety Disorder (GAD) in Q4 2024, with top-line data expected by mid-2026. The company is also preparing to initiate the \*Panorama\* (GAD) and \*Emerge\* (Major Depressive Disorder, MDD) Phase 3 studies in the first half of 2025.

As of September 30, 2024, MindMed reported a strong cash position of $295.3 million, which is expected to fund operations through 2027, covering costs up to 12 months beyond the first Phase 3 data readout for MM120 ODT in GAD.

The company continues to advance its MM120 (LSD) program for both GAD and MDD. It is also progressing with MM402 (R(-)-MDMA) for Autism Spectrum Disorder (ASD), with recent completion of a Phase 1 study.",23,1,1731372642.0
"If Berkshire Hathaway suddenly spent all cash on hand on equities, how much do you think the market would move?","Berkshire Hathaway has the largest pile of cash on hand of any company (or if I'm mistaken is at least in the top 10). If they suddenly bought as much stock as they could, in this environment, how much movement do you think we would see? Would this drive a bullish sentiment in stocks enough across the board to see significant changes? If so, couldn't Buffet essentially start his own stock market surge at any moment by choosing to do this? Not to say this is true of any mega cap company, but specifically for buffett since he is both one of the wealthiest in the world, and is possibly the most sought after voice in the investing world",184,123,1731369693.0
