title,body,upvotes,comments,created
Portfolio Talk,"Hello all, after months of my own research I've made a portolio. I want to preface this by saying this is not a post looking for advice. I am just wanting to tell you all the investments I've made and the reasons behind them. Also, there is some overlap between my individual picks and my ETF picks. I know.

**First, the foundation**

Like any smart investor you need a solid base. Something that will grow steadily and won't make you want to sell out when there is an inevitable market crash. This is why for my first pie, I have gone with 80% VUAG and 20% IGLA.

**Tech Focus**

People may say that my portfolio is too heavily weighted towards the USA and tech, I think the tech giants like Apple etc are not going anywhere. So my allocations are as follows,

Amazon- Moving into the AI space with Nova, Revenue growing steadily YOY.

Microsoft- Almost in the 'too big to fail' category. Not going anywhere and an easy choice IMO.

Alphabet- Recovered well and quickly after 2022 crash. Massive AI player. Easy choice

Apple- Still most popular in the Phone space. Can only see this stock going one way.

Meta- Absolutely flying in recent years. Hopeful Zuck will keep it up.

ASML- Riskier pick but believe they will have a good year next year. Looking 4-5 years into the future with this one.

Nvidia- Don't think I need to say too much with this choice. Looking long term, very excited about this one.

IonQ- Main player in quantum computing space, looking at some volatile years upcoming but I have faith that they could be huge in 5+ years.

**Consumer Focus**

Costco wholesale- Almost unshakeable business model, no strong competition IMO.

Pets at home- Smaller allocation for this one. Seems undervalued to me as people are always going to treat their pets. Will keep tabs on this one as still unsure.

Procter and Gamble- Been around for a million years. Very stable with dividend growth YOY.

Walmart- Consumer powerhouse in USA, strong financials and IMO not going anywhere,#

**Finance Focus**

Berkshire Hathaway- Trust in Buffett, no pressure from short term market trends.

Intuit- Dividend growth YOY, in an incredible place financially.

JP Morgan and Chase- In the 'too big to fail' category in my opinion. Involved in so many industries so not dependent on one for revenue.

MasterCard- Very able to adapt to the market, only risk is inflation IMO.

PayPal- After share price crash in 2022. Revenues didn't faulter and net income bounced back within the year. Undervalued IMO.

S&P Global- Adapting well to new tech such as AI. Been around forever.

**Real Estate Focus**

Realty income- Unshaken by the market crashes in past 20 years. Dividend Growth YOY.

VICI properties- Predictable revenue due to triple net leases. In a strong financial postion.

I think I have a good mix of sectors and stability/growth. I am not looking for advice but will take onboard any criticism.

Thanks all.",3,1,1733681936.0
"If you had to start again today and could only choose five stocks to set you up for the rest of your life, what would they be?","If you had to start again today and could only choose five stocks to set you up for the rest of your life, what would they be?

Imagine you can't do any day trading or chopping and changing. Just five stocks to set you up for the long term.

The tech and AI ones are obvious, particularly stuff like Amazon, NVIDIA, Microsoft etc. I struggle to think of what would be in my guaranteed top five though.",5,18,1733681856.0
Shorting Tesla,"Tesla went up almost 50% after Trump won elections. Although they are friends, Trump might revoke the EV tax credits. And if not Tesla will most likely be excluded from California's EV tax credits which is the inspiration for 12 other states that may or may not follow California's example.

Further Tesla is becoming less of an exclusive brand and revenue (which hasn't seen real growth the last quarters) is mainly from more discounted cars. Of course Tesla is more than just the cars, but it is their core business..

Do you think lower revenue might tank the stock or will it still be interesting due to the different other businesses or that Elon Musk as a CEO is already enough to keep investors in.",17,184,1733670439.0
Help understanding JBT merger,"I recently inherited a retirement brokerage account, which I've never owned before, so I've been crash course educating myself about it. The vast majority of it is made up of ETFs and mutual funds, with the exception of one lone stock, JBT. John Bean Technologies. Currently own about 21 shares.


From my understanding it's a long term hold stock, and has done rather well. I wasn't really planning on touching it anytime soon, but recently JBT has filed to merge with another company, Marel (the latter merging into JBT from my understanding).

Ratings now list it as very Bearish and Sell, but I'd like to know why and what this kind of merger can mean. 

Still learning about all of this. I know not to take the ratings at face value, but I don't know yet how to spot potential red flags so I don't want to just ignore it.

Appreciate any insight. 
",5,7,1733622083.0
SMCI Recovery and loose DD ,"SMCI golden age and beautiful chart. 

After hours Friday SMCI jumped almost 9 percent! Makes perfect sense that investors are flooding back into this stock! It has been so beaten down over the last six months by bad press and fears of fraud. Those fears have been quelled by a new CFO and auditing team. 

We just saw in the last month of 72% rally and there is still plenty of room to run on Monday it will open up around $48, the last critical level we saw was $49.

Also, it looks like a somewhat sloppy cup and handle pattern is forming. My half baked technical analysis is. We will see a minor pull back around $50 to finish the pattern, then it will launch back up to the next critical level around $60 a share. 

Fundamentally speaking, they have been showing plenty of growth and demand for their products which mainly consists of hardware to House semiconductors, especially their trademark marked water cooled rack, which directly addresses a huge issue that centers are facing as computing power gets to Skynet levels. Their price to earnings ratio is a modest 21.9, the earnings per share is a humble 2, the ps ratio is 1.5 which is the lowest among its competitors. In fact all of its metrics or lowest amongst its competitors except for the EPS for AMD, which is 1.1. 

There will be much to see within the next quarterly earnings report and how they managed to address their auditing issues and reporting issues. But I think this company still has room to run and definitely has legs.

I have 200 shares with plans to buy much more. I was going to buy on the next red day, expecting it to be Monday, but I digress. Next pull back I’m buying calls with a strike price of about $49-$55 exp in March.",24,24,1733619096.0
Is it true most people lost money when they start with investing in stocks? What do I do now? ,"So I am 27, and I have a good job, make 200k in tech remotely and have a lot of free time. Because of this, and wanting to make more money, I wanted to start investing to make passive income. 

I was heavily paying off my debt, and now last month I was left 160k in my HYSA after my debt finally went fully paid and 10k in my checking. 

My expenses are not that crazy, so I decided to move this money in my brokerage, and try my hand in investing as HYSA rates are going down. 

This part 2 weeks have been horrible, as I have lost 30k of my 160k lol. 

I was investing in stocks, but I would come back look at 5 minutes later, and they would drop, and I sell. Maybe I have to work on my ability to hold through drops. But the losses added up. 

I have read places that it’s very common for people to lose money in the market starting out, but is this something recoverable? All I see are gains everywhere, but I continue to struggle. 

What do I do next? ",0,152,1733615671.0
Can Wayfair’s New Loyalty Strategy Drive Growth Along with Inevitable Rate Cuts? ,"First let’s get this out the way, Wayfair did see a 30% jump last month, I think this is moreso in anticipation of lowering rates, as of Q3 this yr Wayfair is still reporting a loss currently, I still think they have room to grow.

We don’t need to dive into this piece too deep, but if rates were to lower from highs which they inevitably will home buying goes up and so too does purchases for furniture. Even if there’s customers that think Wayfair is cheap it’s hard to say that they won’t see growth in revenue. So we know revenue will likely grow, which is great but there’s still a negative bottom line.

Wayfair management recently announced some sort of “loyalty program”. You pay an annual fee and you get discounts (which in a scenario where there’s tariffs that raise prices this might help offset some of those costs to the customer). On a surface level you would think this would hurt bottom lines, but there’s a few catches with this. 

For one, management expects those loyal customers who buy an average of two pieces a year will increase to 3 pieces a year, additionally, with 40% of gross profit being spent on advertising, they think they can cut costs by limiting ads where maybe it doesn’t show to a loyal customer who visits Wayfair anyways when looking for furniture. Lastly it’s a small revenue driver but at $29/year the membership cost is so low where it makes that decision to buy a membership that much easier. 

I like the idea since it seems like it’s trying to tackle an efficiency problem in their spending, and tariff wise could offset SOME of the price increases that may make a customer think twice about a purchase. What’s everyone else’s thoughts? Does this stock have more to drop, and do you think this idea could work?



",3,1,1733595800.0
"r/Stocks Weekly Thread on Meme Stocks Saturday - Dec 07, 2024","The meme stock scheduled posts will now run weekly and post Saturday afternoon and won't be a sticky; you're probably seeing this because automod sent you here!

[Full list of meme stocks here.](https://www.reddit.com/r/stocks/wiki/meme-stocks)  This will be updated every once in a while.

------

Welcome traders who just can't help them selves discuss the same exact stock that's been discussed 100s of times a day.  I get it, you want to talk about what's popular, what's hot, and that 1.. single.. stock you like.. well here you go!  Some helpful links just for you:

* [Previous meme stock threads](https://www.reddit.com/r/stocks/search?q=author%3Aautomoderator+title%3A%28common+OR+meme%29&restrict_sr=on&include_over_18=on&sort=new&t=all)
* [General discussions](https://www.reddit.com/r/stocks/search?q=author%3Aautomoderator+title%3Adiscussion&restrict_sr=on&include_over_18=on&sort=new&t=all)
* [The **original GME megathread**](https://www.reddit.com/r/stocks/comments/layb68/rstocks_gme_megathread/) with a ton of useful information
* [Use Finviz for aggregated news on your favorite stock](https://finviz.com/quote.ashx?t=gme)

An important message from the mod team [regarding meme stocks.](https://www.reddit.com/r/stocks/wiki/meme-stocks-warning)

Lastly if you need professional help:

* Problem Gambling:  Call/Text: 1-800-522-4700 or [chat online now.](https://WWW.NCPGAMBLING.ORG/CHAT)
* Crisis Hotline (24/7): 1-800-273-TALK (8255) (Veterans, press 1) or Text “HOME” to 741-741",0,0,1733590816.0
Portfolio Wrapped 2024,"It’s that time of year—Spotify Wrapped is out, and while everyone’s flexing their top artists and I want to bring the stocks into the spotlight.

Your Top Performer: What stock had you bragging to your friends (or kicking yourself for not buying more)?  
Your Biggest Flop: The one that made you question all your life choices.  
Biggest Surprise: That underdog stock or unexpected sector that quietly made bank.  
Sector MVP: Which industry carried your portfolio on its back? Tech? Energy? AI?  
Most “Played” Stock: The one you couldn’t stop buying or selling.

Drop your Portfolio Wrapped stats in the comments.

Mine:

Your Top Performer: FICO  
Your Biggest Flop: ULTA  
Biggest Surprise: PLTR  
Sector MVP: Financial  
Most “Played” Stock: Target (selling)",103,75,1733569475.0
"/r/Stocks Weekend Discussion Saturday - Dec 07, 2024","This is the weekend edition of our stickied discussion thread.  Discuss your trades / moves from last week and what you're planning on doing for the week ahead.

Some helpful links:

* [Finviz](https://finviz.com/quote.ashx?t=spy) for charts, fundamentals, and aggregated news on individual stocks
* [Bloomberg market news](https://www.bloomberg.com/markets)
* StreetInsider news:
  * [Market Check](https://www.streetinsider.com/Market+Check) - Possibly why the market is doing what it's doing including sudden spikes/dips
  * [Reuters aggregated](https://www.streetinsider.com/Reuters) - Global news

If you have a basic question, for example ""what is EPS,"" then google ""investopedia EPS"" and click the investopedia article on it; do this for everything until you have a more in depth question or just want to share what you learned.

Please discuss your portfolios in the [Rate My Portfolio sticky.](https://www.reddit.com/r/stocks/search?q=author%3Aautomoderator+title%3A%22Rate+My+Portfolio%22&restrict_sr=on&sort=new&t=all).

See our past [daily discussions here.](https://www.reddit.com/r/stocks/search?q=author%3Aautomoderator+%22r%2Fstocks+daily+discussion%22&restrict_sr=on&sort=new&t=all)  Also links for:  [Technicals](https://www.reddit.com/r/stocks/search?q=author%3Aautomoderator+title%3Atechnicals&restrict_sr=on&include_over_18=on&sort=new&t=all) Tuesday, [Options Trading](https://www.reddit.com/r/stocks/search?q=author%3Aautomoderator+title%3Aoptions&restrict_sr=on&include_over_18=on&sort=new&t=all) Thursday, and [Fundamentals](https://www.reddit.com/r/stocks/search?q=author%3Aautomoderator+title%3Afundamentals&restrict_sr=on&include_over_18=on&sort=new&t=all) Friday.",3,39,1733567418.0
Best way to establish a short position on MSTR?,"I have strong conviction that MSTR will collapse at some point. It's a speculative bubble based on BTC (another ""asset"" for which I hold low regard, but that's another point entirely). However, I have much less confidence in my ability to predict when this collapse will occur, and I'm aware that the market can stay irrational longer than I can stay solvent. I don't intend for my short position to take more than 1% of my portfolio.

How can I learn more about the best way to short an overpriced security? Right now, it's MSTR, although I'd be interested in the future as well. I'm aware of the following:

* Regular shorting: I'm very hesitant given the possibility of short squeezes with these meme stocks, although I'm trying to calculate how much of this risk is already priced into the other options.
* Put option: Safer, although this is priced into the premium and time decay, which is really expensive for these stocks.
* Inverse daily ETFs: These are simpler to understand on a surface level, although the underlying financial magic that makes them possible is much more complicated. Unfortunately, the only available ones I've found are 2x inverse daily ETFs, which makes this even more volatile and less susceptible to holding longer.

Would it be practical to calculate how expensive these three options are to each other? Or does this require an actual quantitative analyst?",6,55,1733552481.0
Apollo and Workday rally on news they’ll join the S&P 500,">Shares of investment firm Apollo Global Management Inc. and workplace cloud-services platform Workday Inc. rallied after hours on Friday, after S&P Dow Jones Indices said the two companies would join the S&P 500 index later this month.  
>  
>Shares of Apollo gained roughly 6% in extended trading, while Workday shares jumped more than 8%.  
>  
>Their addition to the benchmark large-cap index will take effect before the start of trading on Dec. 23, with the two companies replacing Qorvo Inc. which makes components for mobile devices and other electronics, and engineering-services firm Amentum Holdings Inc. on the S&P 500.  
>  
>In a statement, S&P Dow Jones Indices said the additions to the index “are more representative of the large-cap market space.”  
>  
>Qorvo’s stock was down 1.4% after hours, while Amentum was losing 2%.  
>  
>The addition of Workday, which has a market cap of $69.9 billion, to the S&P 500 follows a wobbly performance for its stock. As of Friday’s close, Workday shares are down 3.5% so far this year. But after the company’s quarterly results last month, some analysts still found things to like.  
>  
>“The company continues to win new enterprise business and take advantage of international and AI growth opportunities,” D.A. Davidson analyst Will Jellison said in a research note last month.  
>  
>Meanwhile, shares of Apollo, as of Friday’s close, have run more than 90% higher this year. After the investment firm, whose market value stands at roughly $99 billion, reported third-quarter earnings last month, J.P. Morgan analysts said the firm “continued to deliver impressive results.”  
>  
>“We view Apollo as a leading alternative asset manager, with its $696 \[billion\] of \[assets under management\] ranking second among publicly traded U.S.-based asset managers (after Blackstone),” the analysts said in their investment thesis on the company.  
>  
>“Apollo has grown faster than peers in recent years, in part driven by its first-mover advantage of understanding the opportunity set around establishing insurance partnerships to help drive fee-related earnings,” the analysts noted.

https://www.msn.com/en-us/money/topstocks/apollo-and-workday-are-joining-the-s-p-500-their-shares-are-rallying/ar-AA1vpS5j",31,5,1733536247.0
Decades of Backtesting: Insights That Changed How I Invest,"
Benjamin Graham once said, “Investment is most intelligent when it is most businesslike.” This quote inspired me to design an investment strategy that mirrors the due diligence and rigor of buying a private business. Instead of relying on trends or speculation, I sought to focus on key factors that truly drive long-term value. These include growth per share, creditworthiness, return on invested capital (ROIC), and shareholder payout. By integrating these metrics into a systematic framework, I aimed to build a strategy that’s rooted in solid business fundamentals.

The Composite Growth Strategy

The framework of my Composite Growth Strategy evaluates companies based on eight critical areas that mimic how you might analyze a private business acquisition:

	1.	Growth Per Share
Focuses on per-share growth in sales, free cash flow, operating cash flow, and gross profit to ensure that growth benefits shareholders directly.

	2.	Absolute Growth
Measures overall growth in gross profit, sales, operating cash flow, and free cash flow, emphasizing strong financial performance.

	3.	Creditworthiness
Evaluates financial stability by analyzing metrics like cash relative to short-term debt, debt coverage through cash flow, and interest expense as a percentage of sales.

	4.	Low Dilution
Prioritizes companies that avoid diluting shareholders by controlling the growth of outstanding shares.

	5.	Intangible Monetization
Assesses how effectively a company utilizes intangible assets, such as intellectual property and goodwill, to generate profits and cash flow.

	6.	Retained ROIC Composite
Measures how well a company reinvests profits into its business, ensuring efficient use of capital to create long-term value.

	7.	Raw ROIC Composite
Analyzes profitability relative to invested capital, focusing on returns generated from gross profit, operating cash flow, and operating income.

	8.	Shareholder Payout
Examines how companies reward shareholders through dividends, buybacks, and consistent increases in payout over time.

Backtesting Results

To validate this strategy, I used backtesting software adjusted for look-ahead bias, spanning data from 2001 to the present. Stocks were ranked every four weeks based on the Composite Growth Strategy, with rankings from 1 (lowest) to 10 (highest).

The results demonstrated a clear trend:

	•	The top-ranked stocks (quantile 10) achieved an annualized excess return of 4.72% over the benchmark.

	•	Conversely, the lowest-ranked stocks (quantile 1) underperformed by -7.81% annually.

	•	Quantiles in between showed a consistent gradient, with performance improving as rankings increased.

Chart in link below

This illustrates that the metrics used in the Composite Growth Strategy not only identify high-quality businesses but also consistently add value over time.

Final Thoughts

This strategy was born from the idea of treating stock selection with the same rigor as buying a private business. By focusing on fundamental metrics like growth, ROIC, and shareholder payouts, it aims to identify companies that compound value over time.

Disclaimer: This is not financial advice. Please do your own due diligence and don’t trust a random stranger on Reddit! 

That said, I’d love to hear your thoughts!

Edit: formatting upgrade

More Data: https://docs.google.com/spreadsheets/d/12DQR_iGAzki6jztermADrBKR7W_elc_rlbaIBlI8Zz8/edit?usp=sharing

Included top 48 names currently

Performance Data",193,75,1733531295.0
Why is LLY a Buy now? ,"Why is this a buy when the P/E is so high? Barrons and IBD calls this a ""buy"". 

The average P/E in that sector is \~20. LLY is at 89ish. The future for sales seem to be dependent on the president's decision on Medicare and Medicaid coverage too. There are other companies testing similar drugs. 

I'm trying to learn to evaluate stocks. Any tips would be great. THX",32,46,1733518958.0
Should I talk my friend out of a $50k investment in $XRT?,"First, me and my friend talk every few week about trades, only a few $ hundred, but this is the first time he's been willing to make such a big trade/investment. $XRT an ok, but not great ETF that traditionally doesn't get a direct boost from holiday shopping when the individual stocks in the ETF report earnings January- March. 

There's still inflation hurting shoppers' spending; not buying the argument that all is good now because holiday payrolls are up and retail CEOs are hyping up their holiday sales expectations. If it goes up, maybe a $1-2. Is my analysis too negative? I was about to tell my friend to just buy Amazon, but only buy 10 shares, nothing major like $50k. Anyone have any different views on $XRT? Thank You",24,59,1733507575.0
Pros and cons of this investment strategy?,"I have Roth IRA with 150k in it and like everyone I want to grow it.  I know it is a “meme” stock but I was looking at GME with this strategy.

Because it is a Roth, I don’t have any tax implications between shot term or long term.  

If I buy 5000k shares @$30 and then 
sell the 40c for 16Jan2026 for $9.50, 
I get $47.5k.  This is an immediate 
return of 31.66%.  

If I take that $47.5k and do the same - 
rinse and repeat until I can’t buy 100 shares to sell a call against.  I end up 
with 7200 Shares with my initial investment of $150k.  I also have 72 contracts at the $40 strike.  So essentially I paid 20.83 per share.  

So for my investment to lose money the price would have to drop below $20.83 
which is the risk with this strategy.  On the other side if the price stays flat at $30 and contracts expire worthless.  
My investment is now worth $216k or a 
44% return in just over a year.  If it does go up and shares are called away, then 
my account is now $288k or a 92% 
return in just over a year.  

Even if price drops 20% it would still be a 15% gain on original investment.

Obviously with any investment you risk losing it all.  So two questions.

1. Is my math correct 

And 

2.  Would you do this and why or why not?",0,13,1733504288.0
