title,body,upvotes,comments,created
Anyone else buying the NU dip?,"I’ve been an investor in NU for a while now. I firmly believe the market is panic selling because Warren Buffet sold 19% of his stake in the company.

Today the company is down again because Citi bank downgraded its rating on NU to a sell.

Why do people care that Citi bank downgraded to a sell? It’s literally a bank that could potentially have to rival NU soon if they break into USA markets. Citi bank is just worried about a rapidly growing, amazing company.

If anything, the downgrade should be seen as a good sign. It shows that american banks like Citi are starting to feel a bit of pressure from how fast NU has been able to expand its user base.

I know Brazil has made changes to its financial regulations. However, NU is rapidly expanding its user base to other countries. Plus, Brazils projected annual GDP growth per year is very good.

Do you guys agree?

~
EDIT:
~
(Thanks for all your thoughts. I’ve realized there are a few key things I overlooked.

I previously thought the stock was heavily owned by retail investors, similar to SoFi’s stock. I naively assumed this because the stock is frequently discussed on social media. Due to this preconceived notion, I believed the stock price would be significantly influenced by analyst ratings. I still think a large number of people have started to sell because of Warren Buffett reducing his stake and Citi’s sell recommendation. However, I now see that the primary factors driving this downturn are geopolitical and economic risks in Brazil.

My updated assessment is that the stock is being sold for a few very valid reasons. Firstly, Brazil’s inflation has been rising over the past few quarters. Secondly, Donald Trump has threatened BRICS nations with 100% tariffs if they decide to create a currency to rival the U.S. dollar. Thirdly, Warren Buffett sold 19% of his stake in the company. Fourthly, the value of Brazil’s currency has been declining and recently hit historic lows compared to the U.S. dollar. Finally, Brazil’s government spending was recently cut, potentially signaling a slowdown in their economy.

Overall, people are very concerned about the economic and geopolitical risks surrounding NU, especially since it is a Brazilian company. Brazil has a historically unstable economy and is currently facing economic headwinds that are amplified by the risk of potential tariffs.

I’m taking a cautious approach from here on out. I won’t be selling any shares, but I also won’t be buying more until the stock price consolidates and the Brazilian economy stabilizes.

I’m still very bullish on NU because the company has grown unbelievably fast in just 11 years. They survived Brazil’s economic collapse in 2014–2016, and they also weathered the last round of U.S. tariffs on Brazil in 2018. I believe NU will continue to expand rapidly into other Latin American countries, which will reduce its exposure to Brazilian tariffs and economic challenges. The CEO and management team are extremely competent, and I believe in their ability to navigate these challenges in the long term.

The worst-case scenario would be if the BRICS nations successfully create a new currency. Even then, I still believe NU will be okay due to its expansion into other markets. For now, I’m holding and remain very bullish on the business.)",30,76,1733151877.0
"These are the stocks on my watchlist (12/2)
","Hi! I am an ex-prop shop equity trader.

This is a daily watchlist for trading: I might trade all/none of the stocks listed, and even stocks not listed! I only hold some/all MAG 7 stocks and market indices long-term. If you use Old Reddit, click “Show Images” at the top to expand the charts. Any positions stated aren’t recommendations, I’m following subreddit rules to disclose positions. I use IBKR TWS for my platform and charts.

I am targeting potentially good candidates to day trade; I have no opinion on them as investments. This means the potential of the stock moving today is what makes it interesting, not the business, long-term prospects, or the people involved.

PLEASE ask specific questions and PLEASE don’t ask about earnings because I typically don’t take positions before earnings announcements. Questions like “Thoughts on \_\_\_\_\_?” or “Why isn’t \_\_\_ on the watchlist?” or something answered already will be ignored unless you add detail and your opinion.  If you post a question and delete it after I answer it, I will block you- doing that hurts discussion. I am not answering questions if I’m still long or short a stock beyond what I update.

Interestingly enough, a lot of executive replacements today.

News: [US Tightens Curbs On China's Access To AI Memory And Chips Tools](https://www.bloomberg.com/news/articles/2024-12-02/us-tightens-curbs-on-china-s-access-to-ai-memory-and-chips-tools)

[**SMCI**](https://finviz.com/quote.ashx?t=SMCI&p=d) \- CFO is being replaced. 

[**NVCR**](https://finviz.com/quote.ashx?t=NVCR&p=d) \- Jumps due to trial results of therapy for pancreatic cancer, Phase 3. Demonstrated statistically significant improvement. Watching $30 level.

[**INTC**](https://finviz.com/quote.ashx?t=INTC&p=d) \- CEO Gelsinger leaves company, stock up around 3%. CFO/Product CEO will serve as interim leaders.

[**STLA**](https://finviz.com/quote.ashx?t=STLA&p=d) \- Stellantis CEO has resigned, effective immediately due to problems in the US, falling sales.

[**TSLA**](https://finviz.com/quote.ashx?t=TSLA&p=d) \- JPM is dropping lawsuit against TSLA over their stock warrants

Earnings: [**ZS**](https://finviz.com/quote.ashx?t=ZS&p=d)",37,6,1733148898.0
Curious what everyone in this sub thinks of MSTR?,"Opinion varies by sub - they guys in MSTR think its going to pump like crazy soon. I'm just curious what you guys think as stock and trading experts.

We all know Michael Saylor has been stacking bitcoin like crazy, and its a leveraged bet on bitcoin. But any opinions are really valuable 

Thanks!",0,82,1733135474.0
"r/Stocks Daily Discussion Monday - Dec 02, 2024","These daily discussions run from Monday to Friday including during our themed posts.

Some helpful links:

* [Finviz](https://finviz.com/quote.ashx?t=spy) for charts, fundamentals, and aggregated news on individual stocks
* [Bloomberg market news](https://www.bloomberg.com/markets)
* StreetInsider news:
  * [Market Check](https://www.streetinsider.com/Market+Check) - Possibly why the market is doing what it's doing including sudden spikes/dips
  * [Reuters aggregated](https://www.streetinsider.com/Reuters) - Global news

If you have a basic question, for example ""what is EPS,"" then google ""investopedia EPS"" and click the investopedia article on it; do this for everything until you have a more in depth question or just want to share what you learned.

Please discuss your portfolios in the [Rate My Portfolio sticky.](https://www.reddit.com/r/stocks/search?q=author%3Aautomoderator+title%3A%22Rate+My+Portfolio%22&restrict_sr=on&sort=new&t=all).

See our past [daily discussions here.](https://www.reddit.com/r/stocks/search?q=author%3Aautomoderator+%22r%2Fstocks+daily+discussion%22&restrict_sr=on&sort=new&t=all)  Also links for:  [Technicals](https://www.reddit.com/r/stocks/search?q=author%3Aautomoderator+title%3Atechnicals&restrict_sr=on&include_over_18=on&sort=new&t=all) Tuesday, [Options Trading](https://www.reddit.com/r/stocks/search?q=author%3Aautomoderator+title%3Aoptions&restrict_sr=on&include_over_18=on&sort=new&t=all) Thursday, and [Fundamentals](https://www.reddit.com/r/stocks/search?q=author%3Aautomoderator+title%3Afundamentals&restrict_sr=on&include_over_18=on&sort=new&t=all) Friday.",6,210,1733135411.0
5 Health care stocks for the next 5 years,"# 1. $NVO - Novo Nordisk

Denmark-based pharmaceutical company that produces weight loss blood sugar/diabetes drugs as the main revenue streams. Growing Intrinsic about 20% / year

# 2. UTHR - United Therapeutics

Biotech for chronic illness. 20-25% Intrinsic growth

# 3. $SOBI:OMX - Swedish Orphan Biovitrum

Swedish rare disease biotech company, 20% Intrinsic growth  ( U.S. ticker ADR is $SWDBY foreign ordinary U.S. is $SDWBF )

# 4. NBIX - Neocrine Biosciences

Neurologicaal disease/disorder pharma. 25% Intrinsic growth

# 5. PODD - Insulet

Biotech devices, Insulin pump. Growing Intrinsic 25% / year",7,50,1733122421.0
Is anyone else a little concerned about this market jump up?,"Listen, I get that it seems like clear skies and rainbows, and I’m not really a “bearish” type investor, but sometimes I find it good practice to sit back for a moment and just reevaluate the current situation we’re in.

I’ll give an example that pertains to me. I’m currently invested in Sofi, PLTR, and RKLB, so this has been an incredible year for me. But looking back, it’s starting to really feel like total and utter exuberance again like 2021. YouTube videos and subreddits have been saying over and over how this is only the beginning and we’re going to be at 500 next year. That’s exactly the type of shit that was said in 2021 right before every small cap stock tanked like 70%. 

I’m not saying it’s a time to sell, I would personally prescribe to the “it’s time to slow down on how much I invest” currently. Buying RKlb at 27$ or PLTR at 66$ is not the same opportunity as in the 4-7$ range as it used to be. It seems very difficult to find any good deals, considering literally almost every sector in the stock market is just going up vertically. And just remember, just it is a great company doesn’t always mean it’s currently a good price to buy it. Sometimes it’s good to take the foot off the breaks when stocks going up 300%+ in one year.

But hey what do I know. Just be careful out there folks, and don’t get sucked too hard into the FOMO. Be fearful when everyone else is greedy and all that jazz.",557,465,1733077454.0
Rate My Portfolio - r/Stocks Quarterly Thread December 2024,"Please use this thread to discuss your portfolio, learn of other stock tickers, and help out users by giving constructive criticism.

Why quarterly?  Public companies report earnings quarterly; many investors take this as an opportunity to rebalance their portfolios.  We highly recommend you do some reading:  A list of [relevant posts & book recommendations.](https://www.reddit.com/r/stocks/wiki/index#wiki_relevant_posts_.26amp.3B_book_recommendations)

You can find stocks on your own by using a scanner like your broker's or [Finviz.](https://finviz.com/screener.ashx)  To help further, here's a list of [relevant websites.](https://www.reddit.com/r/stocks/wiki/index#wiki_relevant_websites.2Fapps)

If you don't have a broker yet, see our [list of brokers](https://www.reddit.com/r/stocks/wiki/index#wiki_brokers_for_investing) or search old posts.  If you haven't started investing or trading yet, then setup your [paper trading to learn basics like market orders vs limit orders.](https://www.reddit.com/r/stocks/wiki/index#wiki_is_there_a_way_to_practice.3F)

Be aware of [Business Cycle Investing](https://eresearch.fidelity.com/eresearch/markets_sectors/sectors/si_business_cycle.jhtml?tab=sibusiness) which Fidelity issues updates to the state of global business cycles every 1 to 3 months (note: Fidelity changes their links often, so search for it since their take on it is enlightening).  [Investopedia's take on the Business Cycle](https://www.investopedia.com/articles/investing/061316/business-cycle-investing-ratios-use-each-cycle.asp).

If you need help with a falling stock price, check out Investopedia's [The Art of Selling A Losing Position](https://www.investopedia.com/articles/02/022002.asp) and their [list of biases.](https://www.investopedia.com/articles/stocks/08/capital-losses.asp)

Here's a list of all the [previous portfolio stickies.](https://www.reddit.com/r/stocks/search?q=author%3Aautomoderator+title%3A%22Rate+My+Portfolio%22&restrict_sr=on&sort=new&t=all)",14,149,1733047222.0
German market - Volkswagen,"I started investing in stock market around 8 years ago and at that time I only did that through my bank in my European country. Time passing and all these broker apps did it so much easier to invest in stock market and NYSE seemed so appealing, that I totally forgot about other markets the last years.
So here I am today, checking German market and specifically Volkswagen and I cannot figure out why is it so much undervalued. I mean look at this EBITDA and cash on hand.
Is there something I missing of? Do you think Trump can hurt Europe that much? Did whole Europe stop investing in European countries? Do you think that German auto manufacturers don’t worth their value? 
What’s your opinion about this?",62,63,1733030185.0
Ocean Exploration Stocks! The next big sector! ,"In my opinion, ocean exploration stocks are heavily overlooked. With only about 5% of the ocean explored, there are so many unknowns and promising possibilities. 

Autonomous underwater vehicles (AUVs) and underwater drones is an emerging technology that I have been keeping a close eye on. This technology will make things like resource exploration, climate change research, scientific research, technological advancements and marine conservation more feasible. The are key factors that will drive growth in this sector the next 5-10 years. 

Currently there are a lot of ocean exploration companies that already have solid revenue streams from oil and gas industries and underwater infrastructure like pipelines and umbilicals. I think these current revenue streams will continue to thrive. And future revenue streams are right around the corner. 

Costs of exploration have been the biggest hurdle in this sector, but as technology continues to advance, costs have been quickly dwindling, making more and more projects feasible. 

Companies that I have recently been researching are: OII and TDY. Would love to hear everyone’s thoughts on these companies, and am excited to hear about other companies you find promising in this sector. 

Side note: I believe that there is a super-intelligent species living in the ocean that we don’t know about yet. Let’s try to find them ;). ",0,32,1732989179.0
"r/Stocks Weekly Thread on Meme Stocks Saturday - Nov 30, 2024","The meme stock scheduled posts will now run weekly and post Saturday afternoon and won't be a sticky; you're probably seeing this because automod sent you here!

[Full list of meme stocks here.](https://www.reddit.com/r/stocks/wiki/meme-stocks)  This will be updated every once in a while.

------

Welcome traders who just can't help them selves discuss the same exact stock that's been discussed 100s of times a day.  I get it, you want to talk about what's popular, what's hot, and that 1.. single.. stock you like.. well here you go!  Some helpful links just for you:

* [Previous meme stock threads](https://www.reddit.com/r/stocks/search?q=author%3Aautomoderator+title%3A%28common+OR+meme%29&restrict_sr=on&include_over_18=on&sort=new&t=all)
* [General discussions](https://www.reddit.com/r/stocks/search?q=author%3Aautomoderator+title%3Adiscussion&restrict_sr=on&include_over_18=on&sort=new&t=all)
* [The **original GME megathread**](https://www.reddit.com/r/stocks/comments/layb68/rstocks_gme_megathread/) with a ton of useful information
* [Use Finviz for aggregated news on your favorite stock](https://finviz.com/quote.ashx?t=gme)

An important message from the mod team [regarding meme stocks.](https://www.reddit.com/r/stocks/wiki/meme-stocks-warning)

Lastly if you need professional help:

* Problem Gambling:  Call/Text: 1-800-522-4700 or [chat online now.](https://WWW.NCPGAMBLING.ORG/CHAT)
* Crisis Hotline (24/7): 1-800-273-TALK (8255) (Veterans, press 1) or Text “HOME” to 741-741",6,2,1732986027.0
"/r/Stocks Weekend Discussion Saturday - Nov 30, 2024","This is the weekend edition of our stickied discussion thread.  Discuss your trades / moves from last week and what you're planning on doing for the week ahead.

Some helpful links:

* [Finviz](https://finviz.com/quote.ashx?t=spy) for charts, fundamentals, and aggregated news on individual stocks
* [Bloomberg market news](https://www.bloomberg.com/markets)
* StreetInsider news:
  * [Market Check](https://www.streetinsider.com/Market+Check) - Possibly why the market is doing what it's doing including sudden spikes/dips
  * [Reuters aggregated](https://www.streetinsider.com/Reuters) - Global news

If you have a basic question, for example ""what is EPS,"" then google ""investopedia EPS"" and click the investopedia article on it; do this for everything until you have a more in depth question or just want to share what you learned.

Please discuss your portfolios in the [Rate My Portfolio sticky.](https://www.reddit.com/r/stocks/search?q=author%3Aautomoderator+title%3A%22Rate+My+Portfolio%22&restrict_sr=on&sort=new&t=all).

See our past [daily discussions here.](https://www.reddit.com/r/stocks/search?q=author%3Aautomoderator+%22r%2Fstocks+daily+discussion%22&restrict_sr=on&sort=new&t=all)  Also links for:  [Technicals](https://www.reddit.com/r/stocks/search?q=author%3Aautomoderator+title%3Atechnicals&restrict_sr=on&include_over_18=on&sort=new&t=all) Tuesday, [Options Trading](https://www.reddit.com/r/stocks/search?q=author%3Aautomoderator+title%3Aoptions&restrict_sr=on&include_over_18=on&sort=new&t=all) Thursday, and [Fundamentals](https://www.reddit.com/r/stocks/search?q=author%3Aautomoderator+title%3Afundamentals&restrict_sr=on&include_over_18=on&sort=new&t=all) Friday.",8,87,1732962617.0
The evolution of an investor - Which level are you?,"I believe there’s a common journey (or evaluation) of an investor. We all start by knowing absolutely nothing about analyzing companies or investing in general, but we get better over time, as we accumulate knowledge and experience.

**Level 1: The Noob**

At this level, the focus is solely on the **share price and its past performance**. So, when the share price goes down from $100 to $30, the noob investor would conclude that now, the stock is cheap and buying is the right thing to do. Of course, this doesn’t have to be the case. In fact, public companies that went bankrupt went on exactly this trajectory. There are plenty of reasons why the share price could collapse, and this decline could be justified. However, the noob investor isn’t aware that there are many questions that one should ask.

In addition, at this level, there’s a **tendency to follow the crowd and the opinion of others**, which is often times a really bad idea. However, without any knowledge and experience, the opinions of others oftentimes sound logical and smart.

**Level 2: The Enthusiast**

The enthusiast has heard that **there’s more to investing than just the share price**. You’ve started exploring financial statements, and you’re learning the basics of accounting. **For the first time, the income statement, balance sheet, and cash flow statement start making sense**. I’m sure everyone can recall that time when you could read the financial statements and understand what they meant. It comes with a confidence boost, and it is normal to think “*Ah, I’ve got this investing thing figured out. It’s easy!*”

The catch is – even though it feels like a superpower, this is still the beginning. Financial statements provide information about what happened, not what will happen. Understanding them is useful, but not enough to be a great investor.

But at least now, you can actually challenge some of the opinions of others.

**Level 3: The Seeker**

This is where one is moving beyond the basics. Now you’ve learned that there are **various valuation techniques**, that allow you to figure out what a company is worth. It gets exciting! This is where you get introduced to the EBITDA and P/E multiples, relative valuation, dividend discount model, and DCF. All of these can be powerful tools, and they’re one piece of the puzzle to understand if a company is undervalued or not. At some point, you will likely stick with one or two models that work best for you.

But here’s the problem. Having the tools isn’t the same as knowing how to use them. At this stage, it is common to have fancy spreadsheets with inputs that aren’t supported in any meaningful way other than historical financial data. Basically, **garbage in – garbage out**. You might not be aware of the disadvantages that come with the various models and fall into some of the common traps.

However, it doesn’t feel that way. When you spend hours gathering data and filling in your inputs, **it feels like a new superpower**, because in the end, there is an output. You have estimated the value of a company, and now you can compare that with the market price.

But, if your assumptions about growth rates, the discount rate, or margins are significantly off, your valuation is meaningless. In fact, there’s a chance it harms you more than it helps you.

By the way, everything that I’ve mentioned until now can be 100% automated. So, up until this level, you have no advantage over a relatively simple algorithm.

**Level 4: The Thinker**

At this point, you understand how important the inputs are.

Therefore, the focus shifts a bit more towards **understanding the industry, and the broader environment**, and asking the right questions so that the input is more solid.

For example, if you are analyzing a car company, you might want to understand if there’s a trend regarding EVs, if there are any regulatory changes that will impact your margins, if the company needs to invest more to expand its capacity, etc.

This is when **research becomes your best friend**. You’re no longer just looking at the company in isolation—you’re connecting the dots between the company, its competitors, and the broader environment. Storytelling also becomes a part of your process, as now you’re not just crunching numbers—you’re building a narrative about the company’s future.

**Level 5: The Pro**

This is the pinnacle of investing and where intangibles come into play.

I don’t mean goodwill and patents. I mean **the management team and the company’s culture**. The key questions here are:

* Is the management trustworthy?
* What is its track record?
* What is its vision?
* Is there a culture that can survive tough times?

Culture is an often-overlooked factor in investing, but it’s incredibly important. As the saying goes, 'Culture eats strategy for breakfast.' A company with a strong culture can attract and retain top talent which is a must for being a great company.

What I find interesting is, that if you are to invest in a private company, you’d get to level 5 sooner than if you invest in public companies.

Here’s an example. Imagine someone walks up to you, and offers you to invest $10k in his company, and in exchange, you’ll have 10% of it. The first question that you’ll have is: Who is this person? If the person in question was someone you know for bad behavior, misleading friends and family, and many failed ventures, you probably have your answer already, and the idea is irrelevant.

However, if it was someone you knew who has integrity and many successful ventures, then you’d probably continue the conversation by asking questions about the idea itself. Your goal would be to understand the business, whether it can survive in the environment, and what return can you expect from it.

I hope you enjoyed this post and wish you great success on your investing journey! Do you recognize these levels in your own progression?

Which level resonates with you the most—and what steps will you take to reach the next one? Share your thoughts in the comments—I’d love to hear your story!",0,23,1732956888.0
23-Hour Party People: U.S. stocks may soon trade nearly around the clock.,"**23-Hour Party People:**  
**U.S. stocks may soon trade nearly around the clock starting in 2025, as the SEC has approved a new platform,** *24 Exchange*. This platform will enable trading of U.S. securities for 23 hours a day, five days a week, with markets remaining closed on weekends.

[https://www.barrons.com/articles/stocks-night-24-7-exchange-sec-abaa72f2?mod=hp\_WIND\_B\_1\_2](https://www.barrons.com/articles/stocks-night-24-7-exchange-sec-abaa72f2?mod=hp_WIND_B_1_2)",499,179,1732903281.0
