title,body,upvotes,comments,created
"/r/Stocks Weekend Discussion Saturday - Nov 23, 2024","This is the weekend edition of our stickied discussion thread.  Discuss your trades / moves from last week and what you're planning on doing for the week ahead.

Some helpful links:

* [Finviz](https://finviz.com/quote.ashx?t=spy) for charts, fundamentals, and aggregated news on individual stocks
* [Bloomberg market news](https://www.bloomberg.com/markets)
* StreetInsider news:
  * [Market Check](https://www.streetinsider.com/Market+Check) - Possibly why the market is doing what it's doing including sudden spikes/dips
  * [Reuters aggregated](https://www.streetinsider.com/Reuters) - Global news

If you have a basic question, for example ""what is EPS,"" then google ""investopedia EPS"" and click the investopedia article on it; do this for everything until you have a more in depth question or just want to share what you learned.

Please discuss your portfolios in the [Rate My Portfolio sticky.](https://www.reddit.com/r/stocks/search?q=author%3Aautomoderator+title%3A%22Rate+My+Portfolio%22&restrict_sr=on&sort=new&t=all).

See our past [daily discussions here.](https://www.reddit.com/r/stocks/search?q=author%3Aautomoderator+%22r%2Fstocks+daily+discussion%22&restrict_sr=on&sort=new&t=all)  Also links for:  [Technicals](https://www.reddit.com/r/stocks/search?q=author%3Aautomoderator+title%3Atechnicals&restrict_sr=on&include_over_18=on&sort=new&t=all) Tuesday, [Options Trading](https://www.reddit.com/r/stocks/search?q=author%3Aautomoderator+title%3Aoptions&restrict_sr=on&include_over_18=on&sort=new&t=all) Thursday, and [Fundamentals](https://www.reddit.com/r/stocks/search?q=author%3Aautomoderator+title%3Afundamentals&restrict_sr=on&include_over_18=on&sort=new&t=all) Friday.",13,57,1732357816.0
Anyone else concerned with this rally?,"I've been super happy since September to see my portfolio take off. I own stocks such as reddit, shopify, square & sofi which all have had fabulous runups in a short span.

Although I'm long on these names I'm seriously considering selling some or all of my shares and tossing it into a etf or nice slow growing dividend stock like mcdonalds or abbvie. 

I've been through this rodeo before where the market blasts off in a short window to just wreck my account.  Basically 2020-2021 and then all of 2022.

If I sell I'm looking at a larger tax bill but it only means I made money afterall.

I'm looking for advise, do you think its wise to start to take some off the table or have you started to sell?
",595,639,1732310593.0
Manchester United stock (NYSE: MANU) – potential to grow,"According to Forbes magazine Manchester United is the second most valuable club in football, only behind Real Madrid. Only Real Madrid and Barcelona have more fans in the world. This is despite the fact that last major trophy they won is Premier League in 2013.  This was the last season with Sir Alex Ferguson at the helm – he is the best manager in history of this club. He retired and since then they are struggling a lot and underperforming. Last season they finished 8^(th) in the Premier League, this season they are 13^(th). Disappointment. They play in Europa League, second tier competition in Europe. The real money is in Champions League.

They have a tremendous potential. Big history, a lot of fans, a lot of money. They should compete for the most important throphies every year. But they didn’t in previous years and fans are angry about that.

Things are subject to change though. At the end of 2023 Sir James Ratcliffe bought 25% of club’s shares. He is the fan of the club and he has a lot to say about how the club is run. He is committed to rebuilding club and bring back glory the club aspire to. On January 2024 Omar Berrada was appointed as new CEO of the club, chief executive officer. He joined United after 13 years spent in Manchester City that was the most successful club in England during this period. On July 2024 Dan Ashworth started to work as sporting director. He worked for Newcastle and Brighton previously. He did a really god job there. In Brighton under his watch they transferred in Caicedo, Mac Allister, Cucurella, Mitoma and Trossard, they sold them later for more money. In Newcastle he was in charged when they bought Isak, Gordon, Barnes, Tonali and Botman. Great business. Recently they hired Ruben Amorim, who was successful in Sporting Lisboa. In the summer he was considered as new Liverpool FC manager, eventually they decided to go with Arne Slot who is excellent in his new role.

The future for Manchester United is bright. They have a competent people running the club. Ruben Amorim is one of the best of young managers in the world and seems to be a really good pick who is able to transform the whole club like Jurgen Klopp did it at Liverpool in the last decade. He needs time but he seems to be capable of making Manchester United great again. They were underperforming in the last 10 years but finally they addressed the issues and should be performing better. They need a time, of course, to build strong team. The thing is – if they perform on the pitch, they earn more money. I believe it is the matter of time before they are on the top. And when they reach this level, when they compete amongst really the best, their stock price should be much higher than it is now.

I think they will be a strong again very soon, they will compete and good performance on the pitch will result with big amount of cash going to the club. The next 10 years should be much better than the last 10 years. Currently their stock price is 17,47 USD. They certainly has potential for more. One more reason is – there are more and more money in football every year so this is another factor in favor of this stock.

I think that this club will compete for Premier League and Champions League in 2-4 years and it should have a huge impact on their finances. My opinion is this stock has potential to grow. Am I wrong? What do you think? I am new in the stock market so maybe I am missing something.",0,13,1732310301.0
"After being wrong about MBLY, BOFA doubles down: ""BofA Securities Trims Mobileye Global Price Target to $12 From $13""","Max pain for options on MBLY is misleading when we have over 20% of the float shorted and underwater, the smart ones closed when it was sold off, and then some trading professionals such as BOFA securities/their-friends/people-who listen-to-them, likely opened new shorts at the bottom and tried convincing others to follow their lead.

Then as we would usually see analysts revise their predictions after the market moves (especially if they called it wrong), to make it seem they are smart or something, BOFA securities revised their predictions, to be even more wrong, showing that they are doubling down on their/people-who-listen-to-theirtrading-advice shorts and are willing to be in denial on a stock even if the market decides they are wrong.

Its not the end of the world to have entrenched shorts, since at the end of the day their losses are unlimited, and when they do close its more capital injected, the longer they waited.

Source: https://www.marketbeat.com/stocks/NASDAQ/MBLY/short-interest/",0,0,1732303851.0
Are we putting too much faith in generative AI? Could this hurt AI investments more broadly?,"Obviously a lot of money is being made off of AI-related stocks. I'm not one of those lucky investors. Part of the reason is that I fear we're not in a general AI bubble, as many have discussed, but rather a *generative AI* bubble. I'd appreciate hearing how others feel about this.

Right now, by far the bulk of investment is focused on generative AI (especially LLMs), with NVDA at or very near the center of it all, thanks to its GPUs. Meanwhile, alternative AI approaches (e.g., neuromorphic computing, symbolic AI, reinforcement learning, and hybrid models) have been getting far less attention.

The problem? As impressive as it may seem, generative AI has some significant (and inherent) drawbacks:

* Factually unreliable outputs (it can’t reliably distinguish fact from fiction)
* Probabilistic reasoning (no true causal understanding)
* High computational costs (questionable sustainability)
* Limited real-world problem-solving abilities

At some point, the reality of generative AI's limitations will become apparent enough to investors that we could see an AI market correction or even collapse. This would not only hurt AI stocks like NVDA, but it could also starve funding for alternative AI approaches that have long-term potential yet have been largely overlooked.

What do you think? How is this influencing your investment decisions?",56,43,1732300870.0
Before P.Diddy We Had Wynn - Do You Think Wynn Resorts Can Recover From the Scandal?,"Hey guys, in 2018, sexual misconduct allegations against its CEO, Steve Wynn, led to his resignation, ruined Wynn Resorts’s reputation, and also caused an 18% stock drop, here is the full story: [https://www.benzinga.com/markets/24/11/42050388/high-stakes-and-higher-scandals-inside-wynn-resorts-legal-and-ethical-crisis](https://www.benzinga.com/markets/24/11/42050388/high-stakes-and-higher-scandals-inside-wynn-resorts-legal-and-ethical-crisis) 

So.. do you know about Wynn Resorts? Did you ever invest in it? Do you think they will recover at some point?",0,1,1732294970.0
"FAA Green Light, $6B Orders, Stellantis Millions: Archer Aviation's $5M Flying Taxis may be the Tesla of the Sky","ACHR isn't just another eVTOL play. They are literally building the future of transportation while everyone else is still drawing pictures.

Their manufacturing facility will be completed in weeks. They have received a [$400M backing from Stellantis](https://beyondspx.com/article/archer-aviation-pioneering-the-future-of-electric-aviation) for production. This is not some vaporware - they have real manufacturing power. The company will pump out 650 aircraft yearly. That translates to billions in revenue when each Midnight sells for $5M+.

Regarding FAA certification, they have [already nailed Phase 3 of 4](https://finance.yahoo.com/news/archer-announces-third-quarter-2024-210500611.html). While other companies are still figuring out how to get off the ground, ACHR has already obtained their Part 135 certificate. They are ready to operate the moment they receive final approval.

Their international expansion is moving at an incredible pace. A [massive UAE deal is coming in Q4 2025](https://finance.yahoo.com/news/archer-hires-uae-leader-abu-050000552.html). They have just secured the UAE's top aviation regulator. Additionally, they have a [Japan Airlines partnership locked in](https://finance.yahoo.com/news/japan-airlines-sumitomo-corporation-joint-venture-130000670.html), which includes a $500M aircraft order. Their order book has now reached $6B+ with actual orders and deposits.

The most compelling aspect is that they have $500M cash on hand. They are burning far less capital than their competitors. With a big auto partnership, upcoming FAA approval, global expansion, and a first-mover advantage in a trillion-dollar market, this is not some penny stock moonshot. They are positioned as the next Tesla of the skies. The infrastructure is ready, regulations are green-lit, and wealthy individuals are eager for flying taxis. The numbers speak for themselves. But, perhaps I am too optomistic - I'd love to hear your thoughts.",45,30,1732293774.0
Thoughts and dilemma on Rocket Lab? ,"I went into Rocket Lab back in July with the intention of making it my primary long-term growth stock and since then have managed to acquire 440 shares at average price of around $9.  

My intention was/is to keep buying and hold the stock for many many years, because I truly believe in the company potential and the overall space industry and I believe that it will be a key growth sector for the next decade and beyond regardless of who is in power in the US. (I am not american btw)

Just before the election I was in profit in the low thousands, which was nice but since the election I am now sitting at a profit of 147%, which is my best position in my investing ""career"" so far. 

Like I said, I believe the company will do well regardless of who is in power. However, given the fast rise since the election I am expecting correction happening soon. 

And my dilemma is: should exit now and take the profits and then go back in after the correction? Or should I just hold until the potential correction and start buying more then? 

What would you do in my situation?",150,187,1732281619.0
What I learnt from MSTR frenzy,"I have been a long term investor in MSTR, in fact buying  my position Pre-split.  
My thesis was very much connected to an alternative investment vehicle into Bitcoin.  Even though I have BTC as a holding in my crypto, I was more after exposure in an equity portfolio.

To cut a long story short, I bought it when it was no mainstream and no ETF's were existing.

I must admit, I sat on a loss for about one year in MSTR.  Buying at $48.10 (split adjusted), and for the longest time sitting at the $25-$30 range, BTC was consolidating and I was fine with that.

If people understand what MSTR are doing, this playbook with bonds and hedging BTC was already in play for a long time, I was lucky enough to understand this quite early and and bought it quite early.  The difference being now that BTC is on a breakout and other companies are now looking into this method as well, the eyes on MSTR has multiplied exponentially .

Fast forward one year, and and the FOMO crowd arrived, and with that volatility.

Here is what I learnt when the FOMO arrived:

1. The stock is no longer trading on anything but emotion and speculation.
2. Valuations do not matter anymore.  The premium on BTC was as low as 1.5 less than one year go, reaching a peak earlier this week at 3.5
3. The stock goes up like crazy, and comes down like crazy, and when this happens, it's time to exit as there is nothing that is in your control.
4. There is so much manipulation (e.g. the citron report, Social media, Mainstream coverage), on what... a damn tweet!  it is not really easy to understand how this will move, so at this point it is just gambling.

I held my position up to the $543 level, and eventually my stop losses triggered yesterday around the $500 level.  So after 1.5 years, I am out of the MSTR trade.

The lesson I learnt is when the crowds arrive, turn round and walk away.

I still believe in the MSTR playbook, but will only come back when I am at the front of the queue buying at a negotiated price not when I am in a bidding war with gamblers.",515,174,1732271709.0
"r/Stocks Daily Discussion & Fundamentals Friday Nov 22, 2024","This is the daily discussion, so anything stocks related is fine, but the theme for today is on fundamentals, but if fundamentals aren't your thing then just ignore the theme.

Some helpful day to day links, including news:

* [Finviz](https://finviz.com/quote.ashx?t=spy) for charts, fundamentals, and aggregated news on individual stocks
* [Bloomberg market news](https://www.bloomberg.com/markets)
* StreetInsider news:
  * [Market Check](https://www.streetinsider.com/Market+Check) - Possibly why the market is doing what it's doing including sudden spikes/dips
  * [Reuters aggregated](https://www.streetinsider.com/Reuters) - Global news

-----

Most fundamentals are updated every 3 months due to the fact that corporations release earnings reports every quarter, so traders are always speculating at what those earnings will say, and investors may change the size of their holdings based on those reports.

Expect a lot of volatility around earnings, but it usually doesn't matter if you're holding long term, but keep in mind the importance of earnings reports because a trend of declining earnings or a decline in some other fundamental will drive the stock down over the long term as well.

But growth stocks don't rely so much on EPS or revenue as long as they beat some other metric like subscriber count:  Going from 1 million to 10 million subscribers means more revenue in the future.

Value stocks do rely on earnings reports, investors look for wall street expectations to be beaten on both EPS & revenue.  You'll also find value stocks pay dividends, but never invest in a company solely for its dividend.


See the following word cloud and click through for the wiki:

[Market Cap - Shares Outstanding - Volume - Dividend - EPS - P/E Ratio - EPS Q/Q - PEG - Sales Q/Q - Return on Assets (ROA) - Return on Equity (ROE) - BETA - SMA - quarterly earnings](https://www.reddit.com/r/stocks/wiki/fundamentals-themed-post)

If you have a basic question, for example ""what is EBITDA,"" then google ""investopedia EBITDA"" and click the Investopedia article on it; do this for everything until you have a more in depth question or just want to share what you learned.

Useful links:

* [Investopedia page](https://www.investopedia.com/fundamental-analysis-4689757/) on fundamental analysis including [Discounted Cash Flow](https://www.investopedia.com/university/dcf/) analysis; see [definition here](https://www.investopedia.com/terms/d/dcf.asp) and read [their PDF on the topic.](http://i.investopedia.com/inv/pdf/tutorials/fundamentalanalysis_intro.pdf)
* [FINVIZ](https://finviz.com/quote.ashx?t=aapl) for fundamental data, charts, and aggregated news
* [Earnings Whisper](https://www.earningswhispers.com/stocks/aapl) for earnings details

See our past [daily discussions here.](https://www.reddit.com/r/stocks/search?q=author%3Aautomoderator+%22r%2Fstocks+daily+discussion%22&restrict_sr=on&sort=new&t=all)  Also links for:  [Technicals](https://www.reddit.com/r/stocks/search?q=author%3Aautomoderator+title%3Atechnicals&restrict_sr=on&include_over_18=on&sort=new&t=all) Tuesday, [Options Trading](https://www.reddit.com/r/stocks/search?q=author%3Aautomoderator+title%3Aoptions&restrict_sr=on&include_over_18=on&sort=new&t=all) Thursday, and [Fundamentals](https://www.reddit.com/r/stocks/search?q=author%3Aautomoderator+title%3Afundamentals&restrict_sr=on&include_over_18=on&sort=new&t=all) Friday.",15,256,1732271412.0
"OK, Here is the main reason that why Biotech companies don't make money in China","My original post here [Why is NVO willing to sell drugs at such low price in China? : r/stocks](https://www.reddit.com/r/stocks/comments/1gwsahb/why_is_nvo_willing_to_sell_drugs_at_such_low/)
Even NVO facing IP challenges that some local biotech using the patent and China rules not favor NVO. 

  
Anyway, After spoke with one my friends, who works as a data scientists in BlackRock  focusing on analyze Biotech and Pharma. She told me the institutions don't really model Chinese market since these Pharma companies don't get much profit. She said the main reason is that, China leveraging its role as a ""developing country"" and medicine to developing countries should be cheap enough as part of humanitarianism.

  
Here is one example of Covid-19 [Pfizer slashed price of Paxlovid, but China wouldn't take it: industry insider – Radio Free Asia](https://www.rfa.org/english/news/china/covid-paxlovid-price-01132023122036.html)

  
where China pressure Pfizer to sell them Paxlovid at the price so cheap that even lower than  **El Salvador**

In NVO weight loss medicine, it should be domestic pharmacy making cheap generic locally ( as mentioned in earlier post) ",83,51,1732245545.0
How is Viking Therapeutics Inc not a no brainer buy right now?,"After some research, I really beleive this stock is gold:

Viking Therapeutics shared updates on its obesity treatment program for VK2735 at ObesityWeek:

Subjects achieved mean weight loss of up to 8.2% from baseline and 6.8% placebo-adjusted weight loss after 28 days of daily dosing at 100 mg. As far as I am concerned, I believe this is more effective than Mounjaro which demonstrated an average weight loss of approximately 4% of starting body weight after 4 weeks of treatment. 

Also, Oral VK2735 demonstrated a favorable safety profile, with 99% of adverse events classified as mild or moderate. The oral option could revolutionize weight loss treatments by offering greater convenience. 

Let’s look at subcutaneous VK2735 Result(or like doses): Weekly subcutaneous injections led to weight reductions of up to 14.7% from baseline. Up to 88% of treated patients achieved ≥10% weight loss, compared to 4% for placebo. Weight loss was progressive throughout the study, with no plateau at 13 weeks.

The obesity drug market is projected to grow to $130 billion by 2030, offering significant upside for VK2735. This is also important because at this size of a market, it can hold many or multiple big players. Analysts also predict Viking could become a takeover target due to its strong pipeline. This would boost the price up to 3 digits.

What’s more! The company also received praise for its liver disease treatment VK2809, which showed positive results in a Phase 2b trial for MASH (metabolic dysfunction-associated steatohepatitis), a serious liver condition affecting 22 million Americans. Reductions in liver fat ranging from 37% to 55% at 52 weeks, with response rates (≥30% reduction) as high as 88%, far exceed typical benchmarks. 

The clinical data reinforce VK2735's potential as a best-in-class obesity treatment with effective weight loss, strong safety, and durability of results. The only reason why the stock hasn’t sky-rocketed is because of fear mongering by market makers in the aftermath of RFK junior, and as far as I’m concerned, diabete and liver diseases will not go away and the desperation I’ve seen for patients to obtain these drug is mad. ",0,29,1732236473.0
MDA (TSE) may list in US,"MDA Space, which is a sleeping giant merely because it trades in the TSE rather than US, is exploring listing in the US, according to comments by its CEO yesterday:

“Management suggested that it continues to explore a potential dual stock listing in the U.S.""

[https://www.cantechletter.com/2024/11/mda-will-prosper-under-trump-2-0-rbc-says/#](https://www.cantechletter.com/2024/11/mda-will-prosper-under-trump-2-0-rbc-says/#)

Considering that it is already profitable (unlike all the other hyped space stocks), has a crazy backlog, will be expanding its satellite manufacturing capabilities in the next few months, and the current hype around space...this is getting ready to seriously take off!",51,10,1732224257.0
The Bullish case for OPRA,"With Google under pressure from the DOJ, this looks like a huge potential for Opera. If Google was forced to sell Chrome, this would give smaller browsers, like Opera, a great chance to gain some market share. Also, when you look at browsers, excluding Edge and Firefox, Opera has a pretty substantial user base by comparison. They are also one of the only ""browser stocks"" that there are. At least the only one of any substance. 



On the flip side, even if Google ISN'T forced to sell Chrome, then we should see the momentum continue for GOOG.

I’ve been a long term holder of OPRA for this very reason. They have a steady growing base of 350M users and are continuing to buy up smaller browser companies. I’ve always looked at OPRA as a hedge against GOOG, at least as far as their browser is concerned. It also pays to hold because they have a great divided.

I’ve been a long term holder of GOOG too though. I think both are great companies, but I’m buying both to more or less hedge my bets.

I think OPRA has a strong chance of seeing some gains if DOJ does follow through.

Positions: GOOG: 6 shares OPRA: 100 shares

  
**TLDR**: Opera (OPRA) and GOOG (Alphabet) look like great buys right now.",0,17,1732213520.0
Nvidia Options Action 11/21: Confusion,"So I have 3 Nvidia calls: 160 11/29, 150 11/29, and 150 1/17/25. P/L on the three is about even and got the 160 a few days ago on a dip trying to make a few bucks betting on earnings driving the price up. As we all saw they crushed earnings and the stock moved up a few points.

What im confused about is the value of my contracts dropped pretty significantly at open although the stock was up. Ive been trading options here and there for the past couple years and seen some “odd” action before but nothing like that. Seems completely opposite what youd expect, can some explain why that happened? Not particularly pressed, a little disappointed cuz i wanted to sell the 160 at open but just confused.",0,9,1732200336.0
Any investors here looking at European markets ?,"Let me preface this by saying I live in Europe and after dabbling initially in companies closer to home switched to US markets due to higher historical returns.

This in hindsight was an excellent decision as almost all my investments in the S&P/Nasdaq have outperformed the ones listed in Europe. So do any American guys look at European markets and see any opportunity to create alpha or are bullish on the EU markets. 

There’s an argument to be made that potentially investing into EU serves as a way to diversify and lower exposure to US markets. But I find it very hard to find good European companies with solid fundamentals that have good stock performance. Could be a myriad of reasons including liquidity, slower growth, more regulation and government oversight. 

Personally the three companies I still have in my portfolio in the EU markets is RR, NVO and LVMH. LVMH is slowing down but most likely due to luxury market turmoil and exposure to China. Additionally NVO is listed on NYSE and had uptil recently performed rather well.

So finally my question being are any guys actively eschewing the American markets for European ones or actively increasing their allocation, if so would love to know the rationale. And more importantly any particular industries or geographies that you’re targeting? ",42,147,1732197702.0
